{
  "catalog_code": "06",
  "catalog_name": "CÓDIGO DE LA UNIDAD DE MEDIDA",
  "description": null,
  "source": "sunat_pdf",
  "is_active": true,
  "items": [
    { "code": "4A", "description": "BOBINAS", "short_name": null, "extra_data": null, "source": "sunat_pdf", "is_official": true, "is_active": true },
    { "code": "BJ", "description": "BALDE", "short_name": null, "extra_data": null, "source": "sunat_pdf", "is_official": true, "is_active": true },
    { "code": "BLL", "description": "BARRILES", "short_name": null, "extra_data": null, "source": "sunat_pdf", "is_official": true, "is_active": true },
    { "code": "BG", "description": "BOLSA", "short_name": null, "extra_data": null, "source": "sunat_pdf", "is_official": true, "is_active": true },
    { "code": "BO", "description": "BOTELLAS", "short_name": null, "extra_data": null, "source": "sunat_pdf", "is_official": true, "is_active": true },
    { "code": "BX", "description": "CAJA", "short_name": null, "extra_data": null, "source": "sunat_pdf", "is_official": true, "is_active": true },
    { "code": "CT", "description": "CARTONES", "short_name": null, "extra_data": null, "source": "sunat_pdf", "is_official": true, "is_active": true },
    { "code": "CMK", "description": "CENTIMETRO CUADRADO", "short_name": null, "extra_data": null, "source": "sunat_pdf", "is_official": true, "is_active": true },
    { "code": "CMQ", "description": "CENTIMETRO CUBICO", "short_name": null, "extra_data": null, "source": "sunat_pdf", "is_official": true, "is_active": true },
    { "code": "CMT", "description": "CENTIMETRO LINEAL", "short_name": null, "extra_data": null, "source": "sunat_pdf", "is_official": true, "is_active": true },
    { "code": "CEN", "description": "CIENTO DE UNIDADES", "short_name": null, "extra_data": null, "source": "sunat_pdf", "is_official": true, "is_active": true },
    { "code": "CY", "description": "CILINDRO", "short_name": null, "extra_data": null, "source": "sunat_pdf", "is_official": true, "is_active": true },
    { "code": "CJ", "description": "CONOS", "short_name": null, "extra_data": null, "source": "sunat_pdf", "is_official": true, "is_active": true },
    { "code": "DZN", "description": "DOCENA", "short_name": null, "extra_data": null, "source": "sunat_pdf", "is_official": true, "is_active": true },
    { "code": "DZP", "description": "DOCENA POR 10**6", "short_name": null, "extra_data": null, "source": "sunat_pdf", "is_official": true, "is_active": true },
    { "code": "BE", "description": "FARDO", "short_name": null, "extra_data": null, "source": "sunat_pdf", "is_official": true, "is_active": true },
    { "code": "GLI", "description": "GALON INGLES (4,545956L)", "short_name": null, "extra_data": null, "source": "sunat_pdf", "is_official": true, "is_active": true },
    { "code": "GRM", "description": "GRAMO", "short_name": null, "extra_data": null, "source": "sunat_pdf", "is_official": true, "is_active": true },
    { "code": "GRO", "description": "GRUESA", "short_name": null, "extra_data": null, "source": "sunat_pdf", "is_official": true, "is_active": true },
    { "code": "HLT", "description": "HECTOLITRO", "short_name": null, "extra_data": null, "source": "sunat_pdf", "is_official": true, "is_active": true },
    { "code": "LEF", "description": "HOJA", "short_name": null, "extra_data": null, "source": "sunat_pdf", "is_official": true, "is_active": true },
    { "code": "SET", "description": "JUEGO", "short_name": null, "extra_data": null, "source": "sunat_pdf", "is_official": true, "is_active": true },
    { "code": "KGM", "description": "KILOGRAMO", "short_name": null, "extra_data": null, "source": "sunat_pdf", "is_official": true, "is_active": true },
    { "code": "KTM", "description": "KILOMETRO", "short_name": null, "extra_data": null, "source": "sunat_pdf", "is_official": true, "is_active": true },
    { "code": "KWH", "description": "KILOVATIO HORA", "short_name": null, "extra_data": null, "source": "sunat_pdf", "is_official": true, "is_active": true },
    { "code": "KT", "description": "KIT", "short_name": null, "extra_data": null, "source": "sunat_pdf", "is_official": true, "is_active": true },
    { "code": "CA", "description": "LATAS", "short_name": null, "extra_data": null, "source": "sunat_pdf", "is_official": true, "is_active": true },
    { "code": "LBR", "description": "LIBRAS", "short_name": null, "extra_data": null, "source": "sunat_pdf", "is_official": true, "is_active": true },
    { "code": "LTR", "description": "LITRO", "short_name": null, "extra_data": null, "source": "sunat_pdf", "is_official": true, "is_active": true },
    { "code": "MWH", "description": "MEGAWATT HORA", "short_name": null, "extra_data": null, "source": "sunat_pdf", "is_official": true, "is_active": true },
    { "code": "MTR", "description": "METRO", "short_name": null, "extra_data": null, "source": "sunat_pdf", "is_official": true, "is_active": true },
    { "code": "MTK", "description": "METRO CUADRADO", "short_name": null, "extra_data": null, "source": "sunat_pdf", "is_official": true, "is_active": true },
    { "code": "MTQ", "description": "METRO CUBICO", "short_name": null, "extra_data": null, "source": "sunat_pdf", "is_official": true, "is_active": true },
    { "code": "MGM", "description": "MILIGRAMOS", "short_name": null, "extra_data": null, "source": "sunat_pdf", "is_official": true, "is_active": true },
    { "code": "MLT", "description": "MILILITRO", "short_name": null, "extra_data": null, "source": "sunat_pdf", "is_official": true, "is_active": true },
    { "code": "MMT", "description": "MILIMETRO", "short_name": null, "extra_data": null, "source": "sunat_pdf", "is_official": true, "is_active": true },
    { "code": "MMK", "description": "MILIMETRO CUADRADO", "short_name": null, "extra_data": null, "source": "sunat_pdf", "is_official": true, "is_active": true },
    { "code": "MMQ", "description": "MILIMETRO CUBICO", "short_name": null, "extra_data": null, "source": "sunat_pdf", "is_official": true, "is_active": true },
    { "code": "MLL", "description": "MILLARES", "short_name": null, "extra_data": null, "source": "sunat_pdf", "is_official": true, "is_active": true },
    { "code": "UM", "description": "MILLON DE UNIDADES", "short_name": null, "extra_data": null, "source": "sunat_pdf", "is_official": true, "is_active": true },
    { "code": "ONZ", "description": "ONZAS", "short_name": null, "extra_data": null, "source": "sunat_pdf", "is_official": true, "is_active": true },
    { "code": "PF", "description": "PALETAS", "short_name": null, "extra_data": null, "source": "sunat_pdf", "is_official": true, "is_active": true },
    { "code": "PK", "description": "PAQUETE", "short_name": null, "extra_data": null, "source": "sunat_pdf", "is_official": true, "is_active": true },
    { "code": "PR", "description": "PAR", "short_name": null, "extra_data": null, "source": "sunat_pdf", "is_official": true, "is_active": true },
    { "code": "FOT", "description": "PIES", "short_name": null, "extra_data": null, "source": "sunat_pdf", "is_official": true, "is_active": true },
    { "code": "FTK", "description": "PIES CUADRADOS", "short_name": null, "extra_data": null, "source": "sunat_pdf", "is_official": true, "is_active": true },
    { "code": "FTQ", "description": "PIES CUBICOS", "short_name": null, "extra_data": null, "source": "sunat_pdf", "is_official": true, "is_active": true },
    { "code": "C62", "description": "PIEZAS", "short_name": null, "extra_data": null, "source": "sunat_pdf", "is_official": true, "is_active": true },
    { "code": "PG", "description": "PLACAS", "short_name": null, "extra_data": null, "source": "sunat_pdf", "is_official": true, "is_active": true },
    { "code": "ST", "description": "PLIEGO", "short_name": null, "extra_data": null, "source": "sunat_pdf", "is_official": true, "is_active": true },
    { "code": "INH", "description": "PULGADAS", "short_name": null, "extra_data": null, "source": "sunat_pdf", "is_official": true, "is_active": true },
    { "code": "RM", "description": "RESMA", "short_name": null, "extra_data": null, "source": "sunat_pdf", "is_official": true, "is_active": true },
    { "code": "DR", "description": "TAMBOR", "short_name": null, "extra_data": null, "source": "sunat_pdf", "is_official": true, "is_active": true },
    { "code": "STN", "description": "TONELADA CORTA", "short_name": null, "extra_data": null, "source": "sunat_pdf", "is_official": true, "is_active": true },
    { "code": "LTN", "description": "TONELADA LARGA", "short_name": null, "extra_data": null, "source": "sunat_pdf", "is_official": true, "is_active": true },
    { "code": "TNE", "description": "TONELADAS", "short_name": null, "extra_data": null, "source": "sunat_pdf", "is_official": true, "is_active": true },
    { "code": "TU", "description": "TUBOS", "short_name": null, "extra_data": null, "source": "sunat_pdf", "is_official": true, "is_active": true },
    { "code": "NIU", "description": "UNIDAD (BIENES)", "short_name": null, "extra_data": null, "source": "sunat_pdf", "is_official": true, "is_active": true },
    { "code": "ZZ", "description": "UNIDAD (SERVICIOS)", "short_name": null, "extra_data": null, "source": "sunat_pdf", "is_official": true, "is_active": true },
    { "code": "GLL", "description": "US GALON (3,7843 L)", "short_name": null, "extra_data": null, "source": "sunat_pdf", "is_official": true, "is_active": true },
    { "code": "YRD", "description": "YARDA", "short_name": null, "extra_data": null, "source": "sunat_pdf", "is_official": true, "is_active": true },
    { "code": "YDK", "description": "YARDA CUADRADA", "short_name": null, "extra_data": null, "source": "sunat_pdf", "is_official": true, "is_active": true }
  ]
}
