{
  "catalog_code": "11",
  "catalog_name": "CÓDIGO DE LA ADUANA",
  "description": null,
  "source": "sunat_pdf",
  "is_active": true,
  "items": [
    { "code": "019", "description": "TUMBES", "short_name": null, "extra_data": null, "source": "sunat_pdf", "is_official": true, "is_active": true },
    { "code": "028", "description": "TALARA", "short_name": null, "extra_data": null, "source": "sunat_pdf", "is_official": true, "is_active": true },
    { "code": "046", "description": "PAITA", "short_name": null, "extra_data": null, "source": "sunat_pdf", "is_official": true, "is_active": true },
    { "code": "055", "description": "CHICLAYO", "short_name": null, "extra_data": null, "source": "sunat_pdf", "is_official": true, "is_active": true },
    { "code": "082", "description": "SALAVERRY", "short_name": null, "extra_data": null, "source": "sunat_pdf", "is_official": true, "is_active": true },
    { "code": "091", "description": "CHIMBOTE", "short_name": null, "extra_data": null, "source": "sunat_pdf", "is_official": true, "is_active": true },
    { "code": "118", "description": "MARITIMA DEL CALLAO", "short_name": null, "extra_data": null, "source": "sunat_pdf", "is_official": true, "is_active": true },
    { "code": "127", "description": "PISCO", "short_name": null, "extra_data": null, "source": "sunat_pdf", "is_official": true, "is_active": true },
    { "code": "145", "description": "MOLLENDO MATARANI", "short_name": null, "extra_data": null, "source": "sunat_pdf", "is_official": true, "is_active": true },
    { "code": "154", "description": "AREQUIPA", "short_name": null, "extra_data": null, "source": "sunat_pdf", "is_official": true, "is_active": true },
    { "code": "163", "description": "ILO", "short_name": null, "extra_data": null, "source": "sunat_pdf", "is_official": true, "is_active": true },
    { "code": "172", "description": "TACNA", "short_name": null, "extra_data": null, "source": "sunat_pdf", "is_official": true, "is_active": true },
    { "code": "181", "description": "PUNO", "short_name": null, "extra_data": null, "source": "sunat_pdf", "is_official": true, "is_active": true },
    { "code": "190", "description": "CUZCO", "short_name": null, "extra_data": null, "source": "sunat_pdf", "is_official": true, "is_active": true },
    { "code": "217", "description": "PUCALLPA", "short_name": null, "extra_data": null, "source": "sunat_pdf", "is_official": true, "is_active": true },
    { "code": "226", "description": "IQUITOS", "short_name": null, "extra_data": null, "source": "sunat_pdf", "is_official": true, "is_active": true },
    { "code": "235", "description": "AEREA DEL CALLAO", "short_name": null, "extra_data": null, "source": "sunat_pdf", "is_official": true, "is_active": true },
    { "code": "244", "description": "POSTAL DE LIMA", "short_name": null, "extra_data": null, "source": "sunat_pdf", "is_official": true, "is_active": true },
    { "code": "262", "description": "DESAGUADERO", "short_name": null, "extra_data": null, "source": "sunat_pdf", "is_official": true, "is_active": true },
    { "code": "271", "description": "TARAPOTO", "short_name": null, "extra_data": null, "source": "sunat_pdf", "is_official": true, "is_active": true },
    { "code": "280", "description": "PUERTO MALDONADO", "short_name": null, "extra_data": null, "source": "sunat_pdf", "is_official": true, "is_active": true },
    { "code": "299", "description": "LA TINA", "short_name": null, "extra_data": null, "source": "sunat_pdf", "is_official": true, "is_active": true },
    { "code": "884", "description": "DEPENDENCIA FERROVIARIA TACNA", "short_name": null, "extra_data": null, "source": "sunat_pdf", "is_official": true, "is_active": true },
    { "code": "893", "description": "DEPENDENCIA POSTAL TACNA", "short_name": null, "extra_data": null, "source": "sunat_pdf", "is_official": true, "is_active": true },
    { "code": "910", "description": "DEPENDENCIA POSTAL AREQUIPA", "short_name": null, "extra_data": null, "source": "sunat_pdf", "is_official": true, "is_active": true },
    { "code": "929", "description": "COMPLEJO FRONTERIZO STA ROSA TACNA", "short_name": null, "extra_data": null, "source": "sunat_pdf", "is_official": true, "is_active": true },
    { "code": "938", "description": "TERMINAL TERRESTRE TACNA", "short_name": null, "extra_data": null, "source": "sunat_pdf", "is_official": true, "is_active": true },
    { "code": "947", "description": "AEROPUERTO TACNA", "short_name": null, "extra_data": null, "source": "sunat_pdf", "is_official": true, "is_active": true },
    { "code": "956", "description": "CETICOS TACNA", "short_name": null, "extra_data": null, "source": "sunat_pdf", "is_official": true, "is_active": true },
    { "code": "965", "description": "DEPENDENCIA POSTAL DE SALAVERRY", "short_name": null, "extra_data": null, "source": "sunat_pdf", "is_official": true, "is_active": true }
  ]
}
