{
  "catalog_code": "12",
  "catalog_name": "TIPO DE OPERACIÓN",
  "description": null,
  "source": "sunat_pdf",
  "is_active": true,
  "items": [
    { "code": "01", "description": "VENTA NACIONAL", "short_name": null, "extra_data": null, "source": "sunat_pdf", "is_official": true, "is_active": true },
    { "code": "02", "description": "COMPRA NACIONAL", "short_name": null, "extra_data": null, "source": "sunat_pdf", "is_official": true, "is_active": true },
    { "code": "03", "description": "CONSIGNACION RECIBIDA", "short_name": null, "extra_data": null, "source": "sunat_pdf", "is_official": true, "is_active": true },
    { "code": "04", "description": "CONSIGNACION ENTREGADA", "short_name": null, "extra_data": null, "source": "sunat_pdf", "is_official": true, "is_active": true },
    { "code": "05", "description": "DEVOLUCION RECIBIDA", "short_name": null, "extra_data": null, "source": "sunat_pdf", "is_official": true, "is_active": true },
    { "code": "06", "description": "DEVOLUCION ENTREGADA", "short_name": null, "extra_data": null, "source": "sunat_pdf", "is_official": true, "is_active": true },
    { "code": "07", "description": "BONIFICACION", "short_name": null, "extra_data": null, "source": "sunat_pdf", "is_official": true, "is_active": true },
    { "code": "08", "description": "PREMIO", "short_name": null, "extra_data": null, "source": "sunat_pdf", "is_official": true, "is_active": true },
    { "code": "09", "description": "DONACION", "short_name": null, "extra_data": null, "source": "sunat_pdf", "is_official": true, "is_active": true },
    { "code": "10", "description": "SALIDA A PRODUCCION", "short_name": null, "extra_data": null, "source": "sunat_pdf", "is_official": true, "is_active": true },
    { "code": "11", "description": "SALIDA POR TRANSFERENCIA ENTRE ALMACENES", "short_name": null, "extra_data": null, "source": "sunat_pdf", "is_official": true, "is_active": true },
    { "code": "12", "description": "RETIRO", "short_name": null, "extra_data": null, "source": "sunat_pdf", "is_official": true, "is_active": true },
    { "code": "13", "description": "MERMAS", "short_name": null, "extra_data": null, "source": "sunat_pdf", "is_official": true, "is_active": true },
    { "code": "14", "description": "DESMEDROS", "short_name": null, "extra_data": null, "source": "sunat_pdf", "is_official": true, "is_active": true },
    { "code": "15", "description": "DESTRUCCION", "short_name": null, "extra_data": null, "source": "sunat_pdf", "is_official": true, "is_active": true },
    { "code": "16", "description": "SALDO INICIAL", "short_name": null, "extra_data": null, "source": "sunat_pdf", "is_official": true, "is_active": true },
    { "code": "17", "description": "EXPORTACION", "short_name": null, "extra_data": null, "source": "sunat_pdf", "is_official": true, "is_active": true },
    { "code": "18", "description": "IMPORTACION", "short_name": null, "extra_data": null, "source": "sunat_pdf", "is_official": true, "is_active": true },
    { "code": "19", "description": "ENTRADA DE PRODUCCION", "short_name": null, "extra_data": null, "source": "sunat_pdf", "is_official": true, "is_active": true },
    { "code": "20", "description": "ENTRADA POR DEVOLUCION DE PRODUCCION", "short_name": null, "extra_data": null, "source": "sunat_pdf", "is_official": true, "is_active": true },
    { "code": "21", "description": "ENTRADA POR TRANSFERENCIA ENTRE ALMACENES", "short_name": null, "extra_data": null, "source": "sunat_pdf", "is_official": true, "is_active": true },
    { "code": "22", "description": "ENTRADA POR IDENTIFICACION ERRONEA", "short_name": null, "extra_data": null, "source": "sunat_pdf", "is_official": true, "is_active": true },
    { "code": "23", "description": "SALIDA POR IDENTIFICACION ERRONEA", "short_name": null, "extra_data": null, "source": "sunat_pdf", "is_official": true, "is_active": true },
    { "code": "24", "description": "ENTRADA POR DEVOLUCION DEL CLIENTE", "short_name": null, "extra_data": null, "source": "sunat_pdf", "is_official": true, "is_active": true },
    { "code": "25", "description": "SALIDA POR DEVOLUCION AL PROVEEDOR", "short_name": null, "extra_data": null, "source": "sunat_pdf", "is_official": true, "is_active": true },
    { "code": "26", "description": "ENTRADA PARA SERVICIO DE PRODUCCION", "short_name": null, "extra_data": null, "source": "sunat_pdf", "is_official": true, "is_active": true },
    { "code": "27", "description": "SALIDA POR SERVICIO DE PRODUCCION", "short_name": null, "extra_data": null, "source": "sunat_pdf", "is_official": true, "is_active": true },
    { "code": "28", "description": "AJUSTE POR DIFERENCIA DE INVENTARIO", "short_name": null, "extra_data": null, "source": "sunat_pdf", "is_official": true, "is_active": true },
    { "code": "29", "description": "ENTRADA DE BIENES EN PRESTAMO", "short_name": null, "extra_data": null, "source": "sunat_pdf", "is_official": true, "is_active": true },
    { "code": "30", "description": "SALIDA DE BIENES EN PRESTAMO", "short_name": null, "extra_data": null, "source": "sunat_pdf", "is_official": true, "is_active": true },
    { "code": "31", "description": "ENTRADA DE BIENES EN CUSTODIA", "short_name": null, "extra_data": null, "source": "sunat_pdf", "is_official": true, "is_active": true },
    { "code": "32", "description": "SALIDA DE BIENES EN CUSTODIA", "short_name": null, "extra_data": null, "source": "sunat_pdf", "is_official": true, "is_active": true },
    { "code": "33", "description": "MUESTRAS MEDICAS", "short_name": null, "extra_data": null, "source": "sunat_pdf", "is_official": true, "is_active": true },
    { "code": "34", "description": "PUBLICIDAD", "short_name": null, "extra_data": null, "source": "sunat_pdf", "is_official": true, "is_active": true },
    { "code": "35", "description": "GASTOS DE REPRESENTACION", "short_name": null, "extra_data": null, "source": "sunat_pdf", "is_official": true, "is_active": true },
    { "code": "36", "description": "RETIRO PARA ENTREGA A TRABAJADORES", "short_name": null, "extra_data": null, "source": "sunat_pdf", "is_official": true, "is_active": true },
    { "code": "37", "description": "RETIRO POR CONVENIO COLECTIVO", "short_name": null, "extra_data": null, "source": "sunat_pdf", "is_official": true, "is_active": true },
    { "code": "38", "description": "RETIRO POR SUSTITUCION DE BIEN SINIESTRADO", "short_name": null, "extra_data": null, "source": "sunat_pdf", "is_official": true, "is_active": true },
    { "code": "91", "description": "OTROS 1", "short_name": null, "extra_data": null, "source": "sunat_pdf", "is_official": true, "is_active": true },
    { "code": "92", "description": "OTROS 2", "short_name": null, "extra_data": null, "source": "sunat_pdf", "is_official": true, "is_active": true },
    { "code": "93", "description": "OTROS 3", "short_name": null, "extra_data": null, "source": "sunat_pdf", "is_official": true, "is_active": true },
    { "code": "94", "description": "OTROS 4", "short_name": null, "extra_data": null, "source": "sunat_pdf", "is_official": true, "is_active": true },
    { "code": "95", "description": "OTROS 5", "short_name": null, "extra_data": null, "source": "sunat_pdf", "is_official": true, "is_active": true },
    { "code": "96", "description": "OTROS 6", "short_name": null, "extra_data": null, "source": "sunat_pdf", "is_official": true, "is_active": true },
    { "code": "97", "description": "OTROS 7", "short_name": null, "extra_data": null, "source": "sunat_pdf", "is_official": true, "is_active": true },
    { "code": "98", "description": "OTROS 8", "short_name": null, "extra_data": null, "source": "sunat_pdf", "is_official": true, "is_active": true },
    { "code": "99", "description": "OTROS", "short_name": null, "extra_data": null, "source": "sunat_pdf", "is_official": true, "is_active": true }
  ]
}
