{
  "catalog_code": "25",
  "catalog_name": "CONVENIOS PARA EVITAR LA DOBLE TRIBUTACION",
  "description": null,
  "source": "sunat_pdf",
  "is_active": true,
  "items": [
    { "code": "00", "description": "NINGUNO", "short_name": null, "extra_data": null, "source": "sunat_pdf", "is_official": true, "is_active": true },
    { "code": "01", "description": "CANADA", "short_name": null, "extra_data": null, "source": "sunat_pdf", "is_official": true, "is_active": true },
    { "code": "02", "description": "CHILE", "short_name": null, "extra_data": null, "source": "sunat_pdf", "is_official": true, "is_active": true },
    { "code": "03", "description": "COMUNIDAD ANDINA DE NACIONES (CAN)", "short_name": null, "extra_data": null, "source": "sunat_pdf", "is_official": true, "is_active": true },
    { "code": "04", "description": "BRASIL", "short_name": null, "extra_data": null, "source": "sunat_pdf", "is_official": true, "is_active": true },
    { "code": "05", "description": "ESTADOS UNIDOS MEXICANOS", "short_name": null, "extra_data": null, "source": "sunat_pdf", "is_official": true, "is_active": true },
    { "code": "06", "description": "REPUBLICA DE COREA", "short_name": null, "extra_data": null, "source": "sunat_pdf", "is_official": true, "is_active": true },
    { "code": "07", "description": "CONFEDERACION SUIZA", "short_name": null, "extra_data": null, "source": "sunat_pdf", "is_official": true, "is_active": true },
    { "code": "08", "description": "PORTUGAL", "short_name": null, "extra_data": null, "source": "sunat_pdf", "is_official": true, "is_active": true },
    { "code": "09", "description": "OTROS", "short_name": null, "extra_data": null, "source": "sunat_pdf", "is_official": true, "is_active": true }
  ]
}
